{
  "schema_version": "0.2.0",
  "kind": "dom",
  "evidence_id": "evidence:dom:page:1",
  "page_id": "page:1",
  "actions": {
    "action:1": {
      "element": "link",
      "text": "Items",
      "url": "http://localhost:8080/items",
      "endpoint": "/items",
      "is_state_changing": false,
      "outcome": "enqueued"
    }
  }
}
